{
  "$schema": "http://json-schema.org/draft-07/schema#",
  "title": "ContextOS Benchmark v2 Task Schema",
  "type": "object",
  "properties": {
    "id": {
      "type": "string",
      "description": "Unique immutable identifier for the task"
    },
    "description": {
      "type": "string",
      "description": "The actual prompt provided to the LLM"
    },
    "expectedState": {
      "type": "object",
      "description": "The expected state of the filesystem or output after execution",
      "properties": {
        "filesToExist": {
          "type": "array",
          "items": { "type": "string" }
        },
        "filesToContain": {
          "type": "object",
          "additionalProperties": { "type": "string" }
        }
      }
    },
    "hash": {
      "type": "string",
      "description": "SHA-256 hash of the task for immutability verification"
    }
  },
  "required": ["id", "description", "hash"]
}
